{
  "title": "adipisicing temp",
  "created": "1953-09-05T14:45:47.011Z",
  "modified": "1941-06-18T00:26:24.955Z",
  "body": "Quibusdam natus eaque officiis molestiae assumenda. Rerum quos nam et laborum iure deserunt quae. Totam voluptatem aperiam nesciunt fuga consectetur. Odit laboriosam officiis nulla repudiandae beatae omnis magnam.",
  "identifier": "820a8dc0-74dc-4b3c-9209-5c90aa700bbc"
}