{
  "title": "mollit dolor Lorem voluptate velit",
  "created": "1982-01-26T17:58:33.242Z",
  "modified": "1998-02-22T20:29:40.930Z",
  "body": "Similique assumenda numquam. Qui veniam consequatur neque velit sit autem. Dolores veniam eum voluptas voluptatem laborum. Omnis qui occaecati sapiente dignissimos adipisci beatae et mollitia. Nihil assumenda dignissimos et molestias rerum non. Libero aliquam non ea suscipit molestiae quia distinctio quo ad.",
  "identifier": "efc47fa1-c0cf-49be-85fb-5a56de3a866b",
  "parent": "6856e8bf-862f-4b72-8db9-a8f449af22b1"
}