{
  "title": "reprehenderit",
  "created": "1956-11-21T15:09:13.251Z",
  "modified": "1975-07-15T10:30:15.393Z",
  "body": "Sed molestiae quis quia voluptas autem. Enim quod sequi. Ipsam eaque doloribus placeat ab molestias iusto error. Dolorem occaecati sit voluptas vel quas eos suscipit at assumenda. Et voluptatem adipisci.",
  "identifier": "27f004fa-dbeb-4eb6-a09a-973f5344f0cb",
  "parent": "96e64597-8ac2-4ea1-840c-3afa1bf66007"
}