{
  "title": "ullamco",
  "created": "1986-10-10T22:23:12.114Z",
  "modified": "1952-03-24T17:46:27.143Z",
  "body": "Ad amet in libero ea sequi. Dignissimos facilis cumque odio quos sed cum libero sit nostrum. Reiciendis ut voluptates. Aut rem amet aut laudantium vel repellat. Sunt dolor non dolores voluptatem. Dolorum rem consequatur modi quaerat sapiente eos.",
  "identifier": "79435912-6368-43dd-9baf-9acd2f021ea9",
  "parent": "d4f625af-a3a5-4c1a-9237-eb3dcec89393"
}