{
  "title": "Lorem nisi et cillum nostrud",
  "created": "1957-07-14T11:16:00.931Z",
  "modified": "1994-08-09T17:35:32.143Z",
  "body": "Deserunt dolore dolorem rerum impedit. Optio velit nobis dolore ut facere doloribus ex. Et non sunt maxime saepe vel ipsa. Eligendi et illum doloribus et odit eum ipsum nam et.",
  "identifier": "898a2914-7dcb-4a9b-8fa2-3a12b1a6718b",
  "parent": "17bc34b0-c14c-4fcc-8f9c-0de99424b52a"
}