{
  "title": "deserunt est",
  "created": "1955-10-26T04:15:55.625Z",
  "modified": "2015-10-19T11:29:07.418Z",
  "body": "Commodi eaque quidem sed nisi necessitatibus ipsum impedit. Nemo et odit. Delectus quia consectetur nihil dolor nostrum. Incidunt expedita explicabo ipsa qui repellat nihil officia culpa eius. Itaque tempore dicta cum accusamus ut minus. Molestias rerum qui aliquid.",
  "identifier": "3a20ba4f-1230-409e-baa9-790981882e7a"
}