{
  "title": "irure veniam",
  "created": "2001-06-23T19:33:25.986Z",
  "modified": "1939-12-11T11:52:31.529Z",
  "body": "Aliquid illo et adipisci accusantium rerum excepturi blanditiis et illo. Harum consequuntur eligendi rerum perferendis vel eligendi.",
  "identifier": "9e0cd3c1-d222-4eb4-870a-97eaa1d9bc07",
  "parent": "7695546c-c44e-4152-aa2d-d281fba5e90b"
}