{
  "title": "voluptate minim in",
  "created": "1939-10-14T14:51:13.308Z",
  "modified": "2001-06-30T01:02:43.116Z",
  "body": "Vel quo omnis fugit. Et fugiat perferendis provident rerum cum natus. Numquam aut laudantium. Dolor sed id neque ex maiores odit est vero. Molestias et totam laboriosam id.",
  "identifier": "c1323596-60ce-4947-862b-c0506629b246"
}