{
  "title": "esse veniam exercitation labore non",
  "created": "2018-03-23T06:31:38.077Z",
  "modified": "2017-10-19T01:30:27.295Z",
  "body": "Delectus iste ex in quibusdam. Libero quia in et omnis dicta est necessitatibus cum dignissimos.",
  "identifier": "33ca0412-90d9-4424-878d-f9764a35d851",
  "parent": "17f30fa2-c537-4685-8cef-6884f79f50b5"
}