{
  "title": "sed Duis anim",
  "created": "2014-02-19T12:10:03.788Z",
  "modified": "1971-07-20T08:41:16.136Z",
  "body": "Omnis quod amet magnam libero architecto et nemo. Fuga a qui natus dolorem minima cupiditate dolore. Dolores soluta quae cum aut unde. Tenetur architecto consequatur sed consectetur ut et possimus illum dignissimos.",
  "identifier": "cf057ec6-34c1-4c5f-9303-4687ead9fe9f"
}