{
  "title": "ut do laborum dolor",
  "created": "1954-05-01T23:03:36.710Z",
  "modified": "1986-10-21T18:39:15.539Z",
  "body": "Ipsa omnis consequatur nam neque voluptate deserunt est aut. Consequatur eum eius rerum reiciendis provident est consequatur. Suscipit sit facere fugit molestias. Quo voluptatem id aut. Reprehenderit totam animi sint necessitatibus ex. Qui commodi sit voluptas nemo qui quam itaque.",
  "identifier": "eb501728-8918-4ed7-94e4-a4737aeca6f2"
}