{
  "title": "ex elit minim",
  "created": "2007-10-19T01:46:25.428Z",
  "modified": "1942-01-03T14:02:14.889Z",
  "body": "Quisquam nihil molestias. Eaque deleniti sapiente. Velit occaecati dignissimos architecto. Tenetur aspernatur non distinctio sint. Necessitatibus animi nihil.",
  "identifier": "a74f0082-dda5-47be-ae39-aa6e45aaa96b",
  "parent": "22759a97-b819-4304-903c-cc2a7754a81e"
}