{
  "title": "ex",
  "created": "1981-04-26T08:26:40.564Z",
  "modified": "1958-09-16T06:55:52.769Z",
  "body": "Nulla et et ducimus. Excepturi minima tempore voluptates. Cupiditate et eligendi quaerat soluta beatae labore et sint nam.",
  "identifier": "c890093a-4cb4-45c0-93a9-599e081ba47c",
  "parent": "8184792f-665e-448a-a0a8-304f8b21e943"
}