{
  "title": "proident exercitation",
  "created": "1992-11-12T06:14:52.933Z",
  "modified": "1946-01-09T01:44:32.983Z",
  "body": "Perspiciatis tempora consequatur voluptatum. Dolores quaerat quis illum ut ea cumque voluptatum. Placeat atque eos recusandae porro dolorem et magni quis sint. Quis rem sed. Sed perspiciatis omnis consequatur minus illum omnis vero ut.",
  "identifier": "901bfcb9-84cf-4f4c-bbc5-4775a81f0b74"
}