{
  "title": "in sed voluptate",
  "created": "1942-02-26T01:55:10.027Z",
  "modified": "1962-07-21T23:17:18.723Z",
  "body": "Occaecati autem modi earum. Asperiores dolorem molestiae dolores eos est labore voluptates beatae corrupti. Non autem facilis. Quis ea excepturi autem sint quod deserunt.",
  "identifier": "9a864324-2f4f-41d1-85aa-e06305551c5d"
}