{
  "title": "ipsum fugiat incididunt est consectetur",
  "created": "1985-11-14T13:11:26.350Z",
  "modified": "2019-01-30T14:54:04.017Z",
  "body": "Voluptas qui accusamus itaque non necessitatibus quo eius debitis cum. Nihil non aut dolorum nostrum aut beatae.",
  "identifier": "cd1e7d3f-a16f-4f46-a2e0-05d787fcaf52"
}