{
  "title": "fugiat",
  "created": "1940-12-06T15:31:05.538Z",
  "modified": "2011-06-04T00:19:18.760Z",
  "body": "Qui non sed laboriosam dicta sapiente totam sit. Autem est numquam delectus et. Est laboriosam hic. Impedit nostrum id id ea omnis aliquid hic dolorum. Cumque ea enim odit culpa. Eius reiciendis repellendus aut illo aut corporis.",
  "identifier": "fbb7b586-a29c-4698-8fec-9389285448ab",
  "parent": "b38482b8-6cea-4fc9-a45e-16db59ed95ce"
}