{
  "title": "eu mollit magna est",
  "created": "1952-11-05T16:43:16.279Z",
  "modified": "1955-03-11T08:16:47.085Z",
  "body": "Dolorem soluta dolorem magnam molestiae at dolor in. Similique molestiae odio. Cum magni pariatur soluta. Et pariatur ut laboriosam excepturi cumque et nostrum. Ea est non dolore.",
  "identifier": "751d6f73-881e-4837-91d1-0b5e755a9a1a"
}