{
  "title": "laborum esse",
  "created": "1988-12-30T05:53:46.839Z",
  "modified": "1971-12-27T03:30:34.611Z",
  "body": "Beatae reprehenderit doloribus. Neque iusto inventore libero quaerat. Quo adipisci similique et sunt rerum ea. Earum sit id cumque error est sint dolor.",
  "identifier": "90db66f2-daff-4c40-b847-297a0ecdf696"
}