{
  "title": "est elit eu sed",
  "created": "1986-02-23T14:46:26.316Z",
  "modified": "2003-09-24T07:41:48.795Z",
  "body": "Rerum vel soluta hic. Hic at fugiat natus qui sit voluptatum aliquam voluptatibus quaerat. Repellendus voluptas facere enim impedit non provident est quaerat. Ipsum non ut. Error tenetur perferendis qui vero odit iusto iure nam.",
  "identifier": "861129ff-7926-43ac-9303-ebe225b30b50"
}