{
  "title": "incididunt amet labore consequat",
  "created": "2007-01-05T16:06:55.415Z",
  "modified": "1972-07-27T16:58:55.221Z",
  "body": "Maiores ab quia iusto sapiente quis labore doloribus saepe. Non sit non cupiditate id. Ullam in ut distinctio aut officia vel. Sunt eaque vel et. Voluptatem quis aperiam inventore. Aut dolorum minima est natus magnam illo qui omnis facilis.",
  "identifier": "bdf39594-95ba-49f3-84e1-0f55f784cd0f",
  "parent": "2857dd8e-0327-4b03-ac95-6b71156c7f51"
}