{
  "title": "aliqua occaecat in exercitation mollit",
  "created": "1983-08-03T11:19:08.184Z",
  "modified": "1964-05-23T22:54:44.365Z",
  "body": "Natus voluptas impedit. Aut dolor velit aperiam voluptatum ea. Nobis quo nihil. Aliquid eum cum omnis accusantium ex. Dolores consequatur veniam sed non. Accusamus voluptatem quia omnis ducimus sunt est.",
  "identifier": "932be964-20e0-4c47-9344-05844fd1e990",
  "parent": "7296a20b-17b4-4ecf-bf69-102d98d5c8a3"
}