{
  "title": "aliqua ut",
  "created": "1939-12-10T23:31:35.915Z",
  "modified": "1985-12-07T04:45:37.117Z",
  "body": "Voluptas sed dolor neque iste qui ullam. Qui optio quasi qui est quae enim rerum ut quae. Illum recusandae nesciunt pariatur velit debitis maiores fuga.",
  "identifier": "339500b2-193b-4b2f-8f4e-bebbded069cc"
}