{
  "title": "officia dolor est ullamco culpa",
  "created": "1939-08-13T08:32:19.539Z",
  "modified": "2014-08-27T14:51:51.377Z",
  "body": "Deleniti quia autem fuga ullam consequatur commodi rem. Quia deleniti delectus occaecati facere non ut quo enim. Distinctio voluptatum hic quisquam voluptas.",
  "identifier": "df37633e-6191-4315-9805-b164facf0e22",
  "parent": "baf0a202-f703-458b-a3ab-4e54ede3dc0f"
}